surface	gloss	supergloss	supercompound	i	a	COMMENTS/TODOS	alt_gloss	noun/pronoun	adj/adv	verb	quantifier	conjunction	preposition	affix	interjection	fn	cognates	tok
du	do			2	0			a deed		to do sth; to become sth;  to make sth						marks verb	du (en:1.0:do; zh:0.5:zuo; ru:0.2:дело; de:0.7:tun)
no	no			3	2			zero; nothingness			no; not; zero					question marker	no (en:1.0:no; hi:0.2:नहीं=no; ru:0.4:нет/ноль=not/zero; es:1.0:no; pt:0.8:não=not; it:0.8:non; fr:0.9:non; id:0.4:nol=zero; fi:0.4:nolla=zero; de:0.4:nicht/null; vi:0.1:không); bu (zh); la/le (ar, tok, ta)?	ala
so	like			4	4	TODO consider replace with "of"										as (in the sense of "to dress up AS"); that/who (when introducing relative clause); marks adjective	so (en:0.8:so; zh:0.3:xiang=like; ru:0.7:ЧТО=that; hi:0.4:साsa/समान=like/-ish/resembling, pcm:0.4:se=that; id:0.2:sangat/serupa=very/similar/equal; ar:0.4:سَوَاء=equal; sw:0.4:sawa/sana=similar/very; yo:0.6:sosai=very; tr:0.1:çok=very); da (en:that's, de:dass); lang (tpi:long=of); se (pcm:se=that)
bi	be			5	6	DECISION: "unify with thing? or being/animal? probably not the latter." - person and animal cover that space. And "to thing sth" is more like "to do sth", not "to be sth"		existence; being	extant	to be sth;  to exist; to show up		if					bi (en:1.0:be; ru:0.9:быть; ig:0.2:ịbụ)
de	of			6	8		from: anti-direction	posession		to own sth			of; from; away; genitive marker; intended for				de (es:1.0:de=of; pt:1.0:de=of; it:0.7:di/da=of; fr:0.7:de=of;  id:0.6:dari=of; zh:0.4:de--note"de" is confusing bc it works backwards from zh); long (tpi:bilong); ya (sw:of); ke/ka/ki (hi)	tan
i	this			7	10	"the cognate spects for this/that have higher numbers than the surfaces may seem to imply. Thsi is the case for langauges where i/a seems to regularly contrast proximal/distal, e.g.:
id: sini/sana
de:hier/da
en:this/that
es: aquí/acá
fr:ici/là
zh:zhei/na"		this; he; she; it; the	such; thusly		this					the	i (te:1.0:I=this; kri:0.7:i=he/she, en:0.6:he/'e=he; en:0.3:this; en:0.4:here; es:0.7:aquí; id:0.8:ini=this; id:0.7:ia=he/she; hi:0.5:yehयह=he/she/it/this; pt:0.7:qui; fr:0.8:ici; fr:0.7:il; sn:0.7:iye; sw:0.8:hii; ru:0.1:этот; es:0.1:este; fil:0.7:ito; zh:0.3:zhei; de:0.3:hier)	ni; ona
a	that			8	12			that; he; she; it	such; thusly		that						a (te:1.0:a; zh:0.4:那; fil:0.4:na; ig:0.4:na; en:0.4:that; es:0.7:acá; de:0.4:da/das; hi:0.4:वह; ru:0.3:там; fr:0.6:là; pt:0.6:là; id:0.6:sana)	ni; ona
lai	other			9	14	DECIDED: "consider either merge with different or turn into adjective." — "different" was merged into "change" IIRC.		another thing	other; different		other					and (when "and" doesn't mean "together", e.g. in lists)	lai (id:0.7:lain=other; zh:0.8:来lai=another; zh:0.5:另外lingwai=other; en:0.2:lie); ling (zh:ling; ms:lain=other); nye (zu)
mi	me			10	16			me; I									mi (en:1.0:me; es:1.0:mi; bci:1.0:mi; de:0.8:mir; ga:0.7:mé; hi:0.6:मैं; ru:0.6:мне; pt:0.5:meu; it:0.7:Me; fr:0.3:moi; fi:0.8:minä; sw:0.8:mimi; yo:0.8:emi; ha:0.3:ni; ig:0.1:mmecha=completion; te:0.5:ముగింపు=complete/end)	mi
yu	you			11	18			you; thou									yu (en:1.0:you; de:0.4:du; es:0.2:tú)	sina
swa	self			12	20			self; themselves; themself	just (past)/just about to (future); barely								swa (hi:1.0:swa=self; fr:1.0:soi=self; ga:0.6:-sa=stress clitic; zh:0.2:zi; ru:0.2:себя; fi:0.2:sarili; de:0.2:selbst; te:0.7:స్వీయ)
tu	direction			13	22			direction					to; towards; in order to (para in spanish); por; to (physical or object); para; for the sake of; "this gift is TO you"				tu (en:1.0:to, te:1.0:tu=direction) ; pa (es: pa/para)	tawa
ting	thing			14	24		do	thing; deed; aspect; facet; characteristic; trait; step (aka measure); measure (aka step)	literal; concrete	to do things; to make sth;  to treat (a person well); to do sth						anything	ting (en:0.9:thing; zh:0.6:dongxi; de:0.9:ding)	ijo
yo	have			15	26	TODO merge with "of"? if not, make sure "posession" is ironed out		possession; property		to have sth; to hold sth; to carry sth; to bear sth [archaic]							yo (zh:1.0:yo=have; es:0.1:llevar)	jo
pu	get			16	28	"this could be deprecated to ""hand"" aka ""grasp"", though that conflates active and passive. It could also be ""reverse-give+. However, to be naturalistic, we have kept it an atom.
Lisa: gau is like chinese ""gao lai"" for getting something and sounds a bit like get"	cause-have			to get sth; to obtain sth; to receive sth							po (sw:0.7:kupokea; ru:0.7:получать=get/obtain; te:07:పొందండి=get/obtain; hi:0.2:पाना=get) ; gau (zh:gao lai=get; en:get) ; chu (zh:0.9:qu)
ne	inside			17	30			inside; interior	interior	to enter sth; to go inside sth; to draw sth inside; to suck (e.g. this do inside air)			during (temporal); in; in (static location); inside; within				ne (zh:0.9:nei; ja:0.5:nai; th:0.5:nai; ko:0.5:ane; en:0.2:in;  de:0.2:in; es:0.2:en=in; pt:0.1:em=in;  it:0.2:In=in; sw:0.2:ndani=inside; zu:0.2:ngaphakathi=inside; ig:0.2:n'ime=inside); me (hi:mein); li/lo (te:lo; zh:li)	insa
mai	use			18	32			use; purpose	useful; used	to use sth; to avail o.s. of sth; to take advantage of sth						marks instrumental case	yong (zh:1.0:yong=use; en:0.2:use)	kepeken; pona
ba	with			19	34	"TODO ""and"" as a conjunction should be ""also""; TODO consider merging with touch? (note: also considering merging ""surface"" or ""hand"" into touch)
NOTE: ""ba"" is the only atom with two different meanings, the first being ""with"", and the second being ""please""/marking command"		company	together	to accompany sb;  to be with sb		and	with; por (Spanish)		please	marks command	ba (fa:1.0:ba=with; mn:0.8:ба=and; id:0.2:bersama=together; tr:0.2:birlikte=together); da (chm); le (lus:leh; ga:le; tn:and; tr:ile=with); te (doi:ते); be (ff); na (tpi); ne (lg)
go	go			20	36			a trip; a journey		to go; to journey; to go swh; to attend sth; to visit swh		then; after					go (en:1.0:go; zh:0.7:过; sa:0.5:गा=go; nl:0.5:ga=go!; de:0.5:geh; tr:0.2:gitmek=go); se (vi:sẽ); wi (en:will)	tawa
e	what			21	38	NOTE: what-energy could be merged in	which				what; which						e (te:1.0:E, yo:0.7:ewo?=what?; en:0.6:eh?; zh:0.6:e/nei; pcm:0.1:wetin; es:0.5:que; fr:0.5:quelle; it:0.5:che; pt:0.5:que; ha:0.5:me=what; ig:0.3:Kedu=what; tr:0.5:Ne=what), we (pcm:0.7:wetin)	seme
nai	distance			22	40			distance; difference	far	to get further away; to put distance between yourself and sth;  to get further away from sth							nai (en:0.5:nigh; de:0.4:nahe; ha:0.4:nisa=distance) ; cha ( zh:cha=difference; id:jauh=far)
u	u_			23	42												u (sw:0.4:u-=forms names of countries+class XI noun prefix denoting natural objects+extensions+abstract qualities or collections of small things; yo:0.2:ù=abstract or instrument nominalizing prefix; da:0.0:u-=prefix meaning reversing the meaning; nd:0.0:u-=class 11 nouns -- no clear semantics)
da	big			24	44	"has antonym
note that there are many ""big"" words with 1) ""a"" as stem; and 2) ""b-"""		size; growth; swelling; parent	big; important; very; huge; large; major; great; quite; rather; really; a lot; very much	to swell; to enlarge sth;  to make sth bigger;  to expand sth;  to grow sth (e.g. a plant);  to raise sth (e.g. an animal);  to cutivate sth (e.g. a habit or plants); to do something in a big way						very	da (zh:1.0:da=big; ono:0.3:; es:0.1:tamaño; hi:0.3:बड़ा)	suli
wi	small			25	46	"has antonym
note that many ""small"" words have ""i"" in the stem"	anti-big	smallness; child	small; little; subtle	to shrink sth; to summarize sth							wi (en:1.0:wee)	lili
o	all			26	48	TODO: still not sure if completative (e.g. search—>find, think —> decide) should be all- or end-					all; each; every						o (en:0.6:all, sco:0.8:au, tpi:0.8:ol, pcm:0.8:ol, es:0.2:todo; pt:0.2:todo; it:0.7:ogni; fi:0.2:joka=every; sw:0.2:zote=all; zu:0.2:konke=all; sn:0.2:zvose=all; ha:0.1:kowane=every; yo:0.1:gbogbo=all/every; la:0.3:omne); au (en:0.6:all, sco:1.0:au, tpi:0.7:ol, pcm:0.7:ol, la:0.1:omne); me (zh:mei)	ale
ku	hard			27	50			stone; rock; hardness	stone-like; hard	to harden sth;  to freeze sth							"ku (ono:0.7; zh:0.7:ku=bitter; vi:0.7:khó=difficult?; zu:0.5:kunzima=difficult; ru:0.2:камень=rock; id:0.2:keras=hard; zu:0.2:kanzima=hard; te:0.2:కష్టంkashtam=hard; zu:0.1:okubabayo=bitter; fi:0.2:kivi=stone; sn:0.7:kuoma=hardness; es:0.2:duro=hard; pt:0.2:duro=hard;	it:0.2:duro=hard; fr:0.1:dur=hard; hi:0.2:कठोरता=hardness); nwa (fr:noix)"	kiwen
pau	end			28	52	"DONE check tip/point vs end (for an object). Maybe ""tip"" is just ""small-end"".
Note: has antonym. This one seems pretty important.
TODO: decide whether stay/wait need different after all?"	anti-start	end; ending; completion	complete; to completion (adv); ended; stopped	to finish sth; to complete sth; to end sth; to turn sth off; to close sth; to die; to kill sb/sth; to stop sth				prefix meaning to do something to completion;			pau (haw:1.0:pau=finished/done/destroyed; hwc:1.0:pau=done, finished, el:0.4:παύω=stop; pt:0.3:parar=stop;  es:0.3:parar=stop;  ru:0.6:пауза=pause;  pl:0.6:pauza=pause;         es:0.6:pausa=pause;   pt:0.6:pausa=pause;         it:0.6:pausa=pause;   fr:0.4:pause=pause; ); dai (en:0.7:die, zh:0.5:歹/dai=die); mo (zh:0.9:mo=end; ar:0.3:مكتمل=complete; es:0.3:morir=to die; pt:0.3:morrer=to die; it:0.3:morire=to die; fr:0.3:mourir=to die; sw:0.2:mwisho=end; fil:0.1:mamatay=die);  gwang (zh:0.9:guang=close); dau (zh:0.9:dao=completitive particle)	awen; pake
ga	good			29	54	"bang" is an excellent surface but such a common concept should be CV. Also it conflicts with "eight"		good	good; cool; awesome; nice	to fix sth; to repair sth; to do good							ga (ono:0.3; zh:0.4:hao; en:0.3:good; ar:0.2:جيد; de:0.3:gut; ha:0.5:gyara=repair); hau (zh:hao); bon (la); bang (zh:awesome+help); ku (en:cool); su (sa:good)	pona
ge	give			30	56	Note: give and get are defined antonyms	could be the transitive form of "to have". but that is probably too much simplification	gift; transmission	giving	to give sth;  to transmit sth; to deal (cards)							ge (zh:1.0:给gei=give ; de:0.9:geb=give; en:0.5:give);  de (pie:*deH; es:de; hi:de)
na	number			31	58	"Merged in ""group"", the plural marker. The polysemy of ""number""=""whicth number in a group"" and ""number""=""a quantity"" is a little odd, but English has it too.

There is a bit of an ambiguity of big-number = large group or big number, but prolly fine."		quantity; number; amount; extent (to which something is something); group; team	numerous; a number of	to count sth; to number sth	number; plural marker					number; plural marker	na (ga:0.8:na; de:0.2:-en; ak:0.3:n-;  en:0.3:no/number; es:0.2:número; fr:0.2:nombre; fil:0.2:numero; id:0.2:nomor; sw:0.6:nambari; sn:0.6:nhamba; vi:0.4:nhóm=group); mwe (ki); su (zh:shu=number, la:summa=number, vi:số=number, yue:sou=number; tyv:сан=number, tr:sayı, tt:san, proto-turkic:*sā(j)-=to count, gn:su=thousand ); de (zh)	kulupu; mute; nanpa
nang	can			32	60	"""I can do this"".
""you mean other can you do this or self can you do this?""
Note: In Chinese, 让 means both ""allow"" and ""make"" (he made me clean my room).  This is simpler (more compressed) but strikes me as a bug in the language. On the other hand, collapsing ""allow"" and ""can"" seems more fine...in part because ""can"" is only intransitive, and ""allow"" is only transitive."		ability; permission		to allow sth;  to permit sth;  to let sth						can; may	nang (zh:0.5:neng=can); kang (en, de); ka (vi:có),  pa (fr:peux, es:puede)	ken
wa	one			33	62			whole; unity; one	single	to unify sth; to unite sth	one						wa (ar:0.6:واحد=one; en:0.4:one; te:0.1:ఒక/[w]oka=one)	wan
do	two			34	64						two						do (ga:1.0:do; hi:1.0:दो; ru:0.6:два; es:0.7:dos; fr:0.5:deux; pt:0.6:dois; it:0.4:due; fil:0.2:dalawa; id:0.6:dua; en:0.1:two); dwa (ru:dva; id:dua)	tu
ti	three			35	66						three						ti (en:0.5:three; ru:0.5:три; es:0.3:tres; it:0.3:tre; pt:0.3:três; fr:0.2:trois; fil:0.2:tatlo; sw:0.3:tatu; sn:0.3:tatu; id:0.7:tiga; ar:0.7:ثلاثة/tlieta; hi:0.7:tin); si (en:three)	san; tuli
lu	place			36	68			place; area; field; land; region; yard; court		to put (sth swh); to place (sth swh); to set up sth			at; at (exact location); on (temporal)			anywhere	lu (fr:0.7:lieu; es:0.7:lugar; pt:0.7:lugar; fil:0.7:lugar; bm:0.3:la=place; zh:0.7:陆lu=land); zai (zh); tai (vi); pu (en:0.7:put; es:0.5:poner; ru:0.5:положить; te:0.3:పెట్టడానికి) fang (zh:fang)
we	way			37	70			way; method; solution; explanation; manner		to solve sth						how	we (en:1.0:way; de:0.7:Weg)
yau	want			40	72	TODO: consider changing to "wang" if there is danger of collision of "yau wiboi" / "ya i boi"		desire; want; intention	desirable; intentional	to want sth; to intend; to intend to do sth; to want to do sth							yau (zh:1.0:yao=want); shang (zh); wang (en); 	wile
	fruit-want	depend		40.2		aka result needs X		dependence		to depend on sth
tai	time			41	76	"TODO: ""ever"" needs a better gloss
TODO consider ""teng"" as surface?"		time; a time	times (used to make perfect)	to be time (for sth); to be time to do sth						anytime	tai (en:0.7:time; es:0.3:tiempo; fr:0.2:temps; it:0.3:tempo; pt:0.3:tempo; fi:0.2:aika; de:0.5:Zeit)	tenpo
dwa	must			42	78			obligation		to have to do sth; to be obligated to do sth; to be supposed to do sth						must; should	dwa (fr:1.0:doi; hi:0.5:दायित्व=obligation; ru:0.2:должен=must/should; es:0.2:debe=must; pt:0.2:deve=must; it:0.2:dovere=must; fil:0.3:dapat=must/should; ha:0.3:dole=must; te:0.2:తప్పక=must); bi (zh)
wai	reason			43	80		cause	reason; cause; behalf	causal; on behalf of	to cause sth;  to incite sth			for (to fight for something)				wai (en:0.8:why; zh:0.7:为/wei=for; fr:0.4:raison);  pa (ga:fáth; en:for); kau (es:causa)
pa	fruit			44	82			result; fruit									pa (ta:0.7:pazham=fruit; sa:0.7:phala=fruit; hi:0.7:फल/phal=fruit; hi:0.7:परिणाम/parinam=result;  en:0.1:fruit=fruit; ig:0.2:pụta=result; te:0.7:ఫలితం=fruit; te:0.7:పండు=fruit)	kili
be	front			45	84	has antonym	after	front; the future	facing forwards; forwards; after; beyond; then	to pass; to overtake; to go beyond		after (temporal);	in front of; before (location);			next (temporal); will (marks future)	be (tpi:0.7:bai=future tense marker; sw:0.6:mbele=front/forwards; zh:0.9:备bei=to prepare to; ru:0.4:передний=front; ru:0.4:вперед=forwards;  zh:0.1:hui=future; zh:-0.7:bei=back) ; de (fr:devant; id:depan) ne (pie:nose); mua (iba)	sinpin
se	talk			46	86			talk; speech; story; tale; language	talkative	to say sth; tell sth;  to call sb;  to call sth sth;  to tell (sb sth);  to recount sth; to talk (about sth)							se (en:1.0:say; zh:0.1:shuo=say; fi:0.2:sanoa=say; ru:0.2:сказать=say; tr:0.2:söyle=say; de:0.2:sprech=speak; yo:0.2:sọ=say; fil:0.2:sabihin=say; )	toki
ya	back			47	88	has antonym; "before" is an interesting word, because it literally means "in front". Thus "vorhersagen" etc really refer to time stretching in front of you. Therefore, "back" is a less confusing gloss. Note that this could be anti-front, but is seems too fundamental for that.	before;back; already; past: anti-front	back; the past	facing backwards; backwards; already; before (temporal); in the past; following; last (temporal; e.g. "last friday"); behind (location); ago (temporal)								ya (es:0.8:ya=already; es:0.7:-ía; it:0.5:già=already; fi:0.2:jo=already); ha (en:have, es:ha, de:habe); da (en:done); le (zh:le, fr:l'est); da (vi:đã), se (vi:“sẽ”, fr:s'est); la (zh:le, fr:l'a); ko (zh:hou=back); ba (en:back)
	back-time	before		47.5					before; back then
bo	body			48	92			body; trunk; stem; main part of sth; shape; form;	main; bodily	to form sth; to embody sth; to mould sth; to constitute sth; to make up sth							bo (en:0.4:body; id:0.6:bodi; fi:0.6:bodi; sw:0.6:bodi; id:0.2:badan=body;  id:0.2:batang=trunk; fil:0.2:baul=trunk; es:0.0:cuerpo, id:0.1:tubuh);  ku (some SEA languge si think; sw:ku=main); seng (zh:shen); ti (zh:ti); gan (zh:gan=trunk); mwi (sw:mwili=body)	sijelo
me	middle			49	94			middle; waist	middle; medium; fine; fair; average				among (multiple objects); between				me (fr:0.2:moyenne; en:0.5:medium/middle; es:0.6:medio=middle; pt:0.7:meio=middle; it:0.6:mezzo=middle; fr:0.2:milieu=middle; ru:0.6:между=between; de:0.2:Mitte; te:0.2:మధ్య=middle; hi:0.2:मध्य=middle); mwe (fr:0.7:moyenne; en:0.3:medium/middle; es:0.3:medio=middle; pt:0.3:meio=middle; it:0.3:mezzo=middle; fr:0.2:milieu=middle; ru:0.3:между=between; de:0.2:Mitte; te:0.2:మధ్య=middle)	meso
bu	seek			50	96			search; try; attempt		to try; to seek sth;  to search for sth; to try to do sth; to attempt to do sth							bu (es:0.6:buscar); tai (en:try, sw:tafuta=search); chau (zh:zhao);
bai	light			51	98	"has antonym
like chinese white"		light; white; bright	white; light	to light sth (e.g. a room); to become white; to make sth white							bai (zh:1.0:bai=white; en:0.6:bright; ru:0.4:belyy; tr:0.4:beyaz; es:0.2:blanco; fr:0.2:blanc; de:0.3:Weiß; en:0.3:white); gwang (zh:guang=light; sw:mwanga=light)	suno;walo
ni	dark			52	100	has antonym	anti-light	darkness; blackness; shadow; shade	dark; black	to become black; to make sth black							ni (es:0.4:negro; en:0.3:night; fr:0.2:noir, fr:0.3:nuite; sw:0.3:nyeusi=black; sn:0.2:nhema=black; ig:0.2:nwa=black; te:0.2:నలుపుnalupu=black)	pimeja
twa	through			53	102			hole; passage; tunnel		to go through swh			through				twa (ono:0.2); tang (zh:0.4:tong=through; en:0.2:tunnel; es:0.2:túnel; ru:0.2:туннель; fr:0.2:tunnel; ms:0.3:terowong; de:0.2:Tunnel; tr:0.2:tünel); tong (zh:0.6:tong=through; en:0.2:tunnel; es:0.2:túnel; ru:0.2:туннель; fr:0.2:tunnel; ms:0.3:terowong; de:0.2:Tunnel; tr:0.2:tünel)
twi	kind			54	104	Lisa: a bit like "type"		type; kind; genre	typical; usual; classic								twi (en:0.3:type; es:05:tipo; pt:05:tipo; it:05:tipo; ru:05:tip; fr:05:type; fi:05:tyyppi; tr:0.2:tür)
ta	over			55	106				over; up; above	to be on top of sth/sb;  to pass sth/sb;  to surpass sth/sb			over; up(direction); above				ta (en:0.8:top, id:0.7:atas=on top of; fil:0.7:itaas=top); sang (zh:shang); chu (sw:juu)
su	down			56	108	DECIDED: "really need to decide whether to split out top/bottom from over" — not merging for now at least	no-over	butt; bottom; base; ground; floor	down; fallen; base; fundamental	to fall; to knock over; to drop sth; to down sth; to fell sth; to sit sth. down			underneath (static); down(direction); under					anpa
si	see			57	110			vision; sight; look	looking	to see sth;  to sense sth; to look (at sth);  to meet sb;  to meet sb							si (en:1.0:see; es:0.5:Siento=I feel; pt:0.5:eu sinto=I feel; it:0.2:sento=I feel; fr:0.2:Je me sens=I feel; de:0.6:sehen)	lukin
po	possibility			58	112			possibility	possibly	to doubt sth/sb;  to suspect sth/sb						maybe; may; might; could	po (es:0.6:posible=possible;         pt:0.6:possível=possible;         it:0.6:possibile=possible;         fr:0.6:possible=possible;         fil:0.6:posible=possible; ); me (en:1.0:may; ru:0.2:может/мощь/мог=may/might; fil:0.2:maaari=may; de:0.2:mag)
li	energy			59	114			energy; feeling; power; strength	energetic; feeling	to feel sth; to make someone do something; to force sb to do sth							li (zh:1.0:li力); chi (zh:qi)； mu (de:Mut)	pilin
kai	start			60	116	DECIDED: "merge with 'opening'": — no need unless it feels right later	number-one	beginning; origin; source	original; originally;  ur-;	to start sth;  to begin sth							kai (zh:1.0:kai=start; pie:0.3:*ken=begin; es:0.2:comienzo=beginning; pt:0.2:começo=beginning; fr:0.2:commencer=begin; en:0.2:commence; sn:0.2:kutanga=begin; sw:0.2:kuanza=begin); ken (pie:*ken=begin); fang (de:fang=start; zh:fang=put)	open
dwe	truth			62	118			truth; reality; fact; correctness	correct; true; genuine; realistic; actual; actually; in fact; real	to be genuine; to correct sth/sb; to do sth correctly					yes; ok; okay; indeed; yeah		dwe (zh:1.0:dui=true; ru:0.2:да=yes; ig:0.1:ee=yes; vi:0.1:Đúng=yes); ba/be (de:wahr); sai (tr; es:si=yes); ya (de:ja)
	big-truth	real		62.5		"really-true" -- just a more emphatic form		authenticity	genuine; authentic;  actually; really
to	head			63	122		top-part	head; bud; leader		to drive; to drive sth;  to head sth;  to lead sth							to (zh:1.0:tou; ru:0.2:голова; fr:0.2:tête; it:0.2:testa; id:0.2:tunas=bud; tr:0.5:tomurcuk=bud; te:0.2:తల=head; ha:0.5:toho=bud)	lawa
	head-surface	hat		63.5		"topi" means hat in Indonesian!!	head-thing
kwi	fast			64	126			speed	fast	to speed							kwi (zh:0.5:kuai; en:0.7:quick; id:0.2:kecepatan=speed; sw:0.2:kasi=speed)
gi	high			65	128			hill; breast; bump; lump; height; level; degree	high; tall	to rise; to raise sth							gi (ce:1.0:гу; ga:0.6:cnoic/gcnoic, sw:0.8:kilima=hill; yo:0.2:ga=high; en:0.7:hill+high, ru:0.2:грудь; zh:0.3:高); hai (en:high); gwe (zh:gui; ce:гу; ga:cnoic, en:hill, en:high); *i (sounds like "hill"; has a "high" vowel so semi onomonopoeia);	sewi
la	hot			66	130			temperature; heat	hot	to get hotter; to heat sth (up)							la (zh:0.9:la=hot/spicy; hi:0.6:laal=red, zh:0.2:re=hot; fi:0.6:lämpöä); ko (zh:hou=fire)	seli
lang	long			67	132			length	long	to elongate sth;  to make sth longer							long (en:0.9:long, de:0.8:lang, es:0.8:longitud; hi:0.3:लंबा; pt:0.9:longo; it:0.7:lungo; fr:1.0:long); chang (zh:chang, id:panjang); dai (vi:dai=long); gau (totally random)
	long-time	longtime		67.5				age; aeon	for a long time; for ages
ping	flat			68	136		level; flat; equal	level; a flat thing; evenness; levelness; equality; flatness; pitch (music); leaf; paper	flat; even; level; equal; fair; lying	to level; to equal sth;  to flatten sth; to lay sth;  to set sth;							ping (zh:1.0:ping=level, vi:0.1:bình=peace; ru:0.2:плоский=flat; es:0.2:plano/papel=flat/paper; pt:0.2:plano=flat; it:0.2:Piatto=flat; fr:0.2:plat=flat; fil:0.2:patag; yo:0.4:alapin=flat)	lipu
	no-flat	rough		68.5					rough; course	to ruffle sth
nu	new			69	140	nyu?		youth; freshness; newness; novelty; news	new; early; fresh; novel; raw	to renew sth;  to refresh sth;  to rejuvinate sth							nu (en:1.0:new; de:0.5:neu; ru:0.5:новый; es:0.7:nuevo; it:0.7:nuovo; pt:0.5:novo; fr:0.8:nouveau; hi:0.2:नया)	sin
bwa	opening			70	142		mouth	opening; mouth; entrance; exit; hole; door; window	open; on (of a light); surprise	to make an opening; to open sth;  to make an opening in sth;  to turn sth on; to be surprised; to surprise sb							bwa (es:0.4:boca=mouth; pt:0.4:boca=mouth; it:0.4:bocca=mouth; fr:0.2:bouche=mouth; fil:0.2:bibig=mouth; ha:0.4:budewa=opening); bu (fr:bouche; zu: vula; ha: bude; id: membuka); mung (de:Mund)	lupa; open
	container-opening	door		70.2				door
	light-opening	window		70.3				window
kwang	wide			71	148	"TODO consider whether to deatomize into side-long
link to ausbreiten = to become broad = to spread out; same with zh 播"	spread		wide; broad; thick	to spread sth; to spread sth out; to transmit sth; to disperse sth; to propagate sth							kwang (zh:0.7:广/guǎng=wide, zh:0.8:宽kuan=wide, th:1.0:kwang=wide; sw:0.4:kueneza=to spread)
gwa	easy			72	150	convenient could also be "easy-do" or "fast-do"		ease; easiness; lightness; convenience; smoothness	easy; light; convenient; smooth	to smooth out; to smooth sth out							gwa (zh:1.0:guanghua光滑=smooth; ono:0.8; pl:0.8:gładki; ru:0.4:гладкий; es:0.3:suave=smooth; de:0.4:glatt=smooth); lai (en:light; es:ligero=light[weight]; id:ringan=light[weight]) ; *wa (zh:光滑=smooth; pt:suave=smooth; es:suave=smooth)
sai	side			73	152			side; bank (of river); edge; coast; sharpness									sai (en:0.7:side; as:0.2:ساحل=coast; tr:0.2:sahil=coast; ru:0.2:сторона=side; id:0.3:samping=side; ms:0.2:sebelah=side; de:0.7:Seite=side), s* (ono;  en:sharp, vi:sắc=sharp; ru:ostryi=sharp;, ja:surudosa=sharpness;), beng (zh:bian)	poka
pi	surface			74	154	NOTE: the atom "touch (mwa)" was merged into this	touch	surface; skin; bark; touch; contact	touching	to touch sth; to rub sth; to meet sth; to contact sth; to cross sth; to meet sth							pi (zh:1.0:pi=skin, es:0.8:piel=skin; ko:0.7:pibu=skin; th:0.8:phio=skin; ru:0.2:поверхность=surface; pt:0.3:pele=skin; it:3:pelle=skin; fr:0.2:peau=skin; ms:0.3:permukaan=surface; fi:0.6:pinta=surface; zu:0.2:phezulu=surface; sn:0.2:pamusoro=surface; en:0.5:peel) mwa (ono:0.5, zh:0.8:mo=touch; id:0.2:menyentuh=touch)	selo
yang	color			75	156			color; ink; dye	colored; colorful	to color sth ; to ink sth; to dye sth							yang (zh:0.4:颜=color; hi:0.3:rang=color=color, te:0.3:rang=color, ar:0.3:rang=color; sw:0.2:rangi=color); lang (hi:0.8:rang, te:0.8:rang, ar:0.8:rang; sw:0.7:rangi=color; tr:0.5:renk=color)	kule
kwa	four			76	158						four						ke (ga:0.8:ceathrar; es:0.2:cuatro; fr:0.2:quatre); kwa (ga:0.2:ceathrar; es:0.7:cuatro; fr:0.5:quatre; pt:0.7:quatro)
pai	five			77	160						five						pai (en:0.5:five; hi:0.5:पाँच; ru:0.3:пять)
lau	six			78	162						six						lau (zh:0.6:liu=six; yue:0.5:luk6=six; vi:0.4:sáu); sau (vi:sáu=six)
se	seven			79	164						seven						se (en:0.5:seven; hi:0.2:सात; ar:0.2:سبعة; ru:0.7:Семь; es:0.5:siete; pt:0.6:sete; it:0.6:sete; fr:0.5:sept; fi:0.5:seitsemän; sw:0.2:saba; de:0.3:Sieben); seng (en:0.7:seven; hi:0.2:सात; ar:0.4:سبعة; ru:0.6:Семь; es:0.3:siete; pt:0.6:sete; it:0.6:sete; fr:0.6:sept; fi:0.6:seitsemän; sw:0.2:saba; de:0.3:Sieben); ki (zh:0.6:qi)
bang	eight			80	166						eight						bang (zh:0.6:八ba=eight)
noi	nine			81	168						nine						noi (ga:0.7:nui; de:0.7:neun; hi:0.2:नौ; es:0.5:nueve; pt:0.2:nove=nine; it:0.2:nove=nine; fr:0.2:neuf=nine; ); nyu (Tocharian:nyu, zh-en:nine+jiu)
